Time,Activity,Pain,Gain,ActivityTime
9:30:00 AM,เริ่มทำงาน (work from home),แค่คิดก็เหนื่อย,ได้เคลียร์งาน,Morning
9:30:00 AM,เริ่มทำงาน,งานค้างยังไม่เสร็จ,งานเสร็จตาม requirement,Morning
9:30:00 AM,ล้างจาน,ขี้เกียจ,จานสะอาด,Morning
9:30:00 AM,เล่น sup board ,"แดดร้อนมาก, ลืมทากันแดด","พาย sup board สนุกมาก, ได้ลองอะไรใหม่ๆ, ทิวทัศน์สวยมาก",Morning
9:30:00 AM,เดินทางถึงออฟฟิต,แสกนนิ้วยาก บางทีไม่ติด,สบายใจไม่ถึงเลท,Morning
9:30:00 AM,เริ่มทำงาน,งานเยอะมาก,ได้ใช้ความรู้,Morning
9:30:00 AM,Clear emails & admin tasks,Email composition takes time,Notify to colleages and partners,Morning
9:30:00 AM,Order coffee on grab delivery,Lose focus at the meeting,feel happy,Morning
9:30:00 AM,เริ่มทำงาน WFH,Online skype สาย เป็นที่เพ่งเล็ง,Status online ทำให้คนอื่นดูว่าเราเข้างานตรงเวลา,Morning
9:30:00 AM,ทำงาน,-,-,Morning
9:30:00 AM,Start a work,Stressful job,Earn salary,Morning
9:30:00 AM,ทำงาน,ระบบล่มจะยุ่งหนักมาก,,Morning
9:30:00 AM,ออกไปร้านกาแฟ และอ่านหนังสือในร้านกาแฟ,เสียเวลาในการเดินทาง,ได้บรรยากาศที่ดี,Morning
9:35:00 AM,Read a book,,Today I read the story about how to do gardening ,Morning
9:40:00 AM,เดินทางไปทำงาน,ง่วงนอน,ถึงที่ทำงาน,Morning
9:40:00 AM,ถึงที่ทำงาน,กลัว covid-19,ได้เจอเพื่อนร่วมงาน,Morning
9:40:00 AM,ประชุมวางแผนการทำงานในวันนี้กับแผนกซ่อมบำรุง,วางแผนยาก เพราะเป็น immediate action,ได้จัด priority ของงาน,Morning
9:45:00 AM,ซื้อกาแฟ,ง่วงนอน,ตื่นตัวเมื่อได้ดื่มกาแฟ,Morning
9:45:00 AM,ไปกินกาแฟ,ไม่กินแล้วง่วงนอน ขี้เกียจทำงาน,สดชื่น ,Morning
10:00:00 AM,ประชุม,เครียด มีข้อถกเถียงไม่จบ,ได้ข้อสรุป,Morning
10:00:00 AM,เริ่ม Focus งาน,ชอบมีสายเข้ามา กวน,ได้ความคืบหน้าของงาน,Morning
10:00:00 AM,ประชุมผ่าน MS Team,,สามารถคุยกับทีมที่ต่างประเทศได้สะดวก,Morning
10:00:00 AM,สกรัมผ่าน MS Team,ได้งานเพิ่ม ,ได้แก้ไขปัญหา ได้แชร์งานที่ทำ,Morning
10:00:00 AM,เดินทางด้วย BTS ไปทำงาน,ราคาสูง,เดินทางสะดวกสบาย,Morning
10:00:00 AM,เริ่มงาน,ไม่มี Passive income,ได้เงินเดือนตอนปลายเดือน,Morning
10:00:00 AM,Work on SQL queries from home,Querying via VPN is much slower than from the office,To work anywhere using VPN is convenient,Morning
10:00:00 AM,เคลียร์งาน,เริ่มล้า เมื่อยนิ้ว+มือ,"ได้เคลียร์งาน,งานเสร็จ,มีงานส่ง",Morning
10:00:00 AM,กรรมการตรวจรับเครื่องมือ,เสียงติดคุก,มีเครื่องมือในการทำงานมากขึ้น,Morning
10:00:00 AM,เล่นกับแมว,หงุดหงิดเวลาแมวเอาเล็บมาขวน ดีดตัวหนี,สนุก เห็นความน่ารักของแมว,Morning
10:00:00 AM,เดินไปตู้เย็น กินขนม พร้อมกับเรียนหนังสือ  (online),"ต้องแยก ทำ 2 อย่างพร้อมๆ กัน กินไปด้วย เรียนไปด้วย
ไม่ค่อยมีสมาธิ",ได้ทำ 2 อย่างในเวลาเดียวกัน,Morning
10:00:00 AM,ทำรีพอต,ขี้เกียจทำ น่าเบื่อ,ทำงานเสร็จส่งทันกำหนด,Morning
10:00:00 AM,ประชุมนำเสนองาน,ได้รับผิดชอบงานเพิ่ม,ได้รับคำชมจากเจ้านาย,Morning
10:00:00 AM,ประชุมนำเสนองาน,ได้รับผิดชอบงานเพิ่ม,ได้รับคำชมจากเจ้านาย,Morning
10:00:00 AM,Meeting,หาข้อสรุปไม่ได้,ทุกคนมีความเข้าใจในทางเดียวกัน,Morning
10:00:00 AM,กินขนม,มีความอยากกิน ไม่ได้หิว,อร่อย,Morning
10:00:00 AM,ประชุมงาน,ยังไม่สามารถหาข้อสรุปได้,เริ่มมีทิศทางและแนวโน้มที่ดีขึ้น,Morning
10:00:00 AM,ประชุม,มี issue ต้องคุยกับทีมอื่น,ได้ทำความเข้าใจมากขึ้น,Morning
10:00:00 AM,Deal with customers,Customer cannot talk,More understanding to close sales,Morning
10:00:00 AM,go to GYM,Muscle pain,"more strength for my body, Healthier",Morning
10:00:00 AM,ทำงานตามแผนที่วางไว้,เหนื่อย,เริ่มจัดการงานตามแผน,Morning
10:00:00 AM,เริ่มงาน,เงียบเกินไป,ได้ focus ไปกับงาน,Morning
10:00:00 AM,กินข้าว,อาหารไม่อร่อย,รู้สึกอิ่มอยู่ท้อง,Morning
10:00:00 AM,ทำงานประจำ Generate report,,มีงานส่ง,Morning
10:00:00 AM,ตรวจสอบงานที่ลงตู้,ชอบมองข้ามงานบางงาน,ให้รับรู้ว่างานมาครบ,Morning
10:10:00 AM,Answer wrong quiz,cannot follow the lesson,,Morning
10:15:00 AM,ทำงานต่อ,กลัวงานไม่เสร็จ,ใช้เวลาให้คุ้มค่า ดูขยัน,Morning
10:30:00 AM,วิเคราะห์ สรุปเอกสาร Requirement,ขี้เกียจ คิดเยอะ ปวดสมอง,ได้เงินเดือน ได้เข้าใจ Business,Morning
10:30:00 AM,ถึงที่ทำงาน เริ่มทำงาน,,เป็นช่วงที่พร้อมทำงานที่สุด,Morning
10:30:00 AM,ไปรับ requirement ใหม่จาก user,output งานไม่ตรงกับความต้องการของ user,งานเสร็จได้ตรงเวลา ไม่ต้องแก้งานบ่อย,Morning
10:30:00 AM,Attend weekly team meeting,,Aligned team direction and update team on progress and issue,Morning
10:30:00 AM,กินกาแฟ,ง่วง,สดชื่น หายง่วง,Morning
10:30:00 AM,อัพรูปตอนเที่ยวลง facebook,อยากไปเที่ยว แต่ติดช่วง COVID ทำให้ไปไม่ได้,สบายใจ แก้เบื่อ,Morning
10:30:00 AM,พักเบรค กินแซนวิช,ไม่อิ่ม,ได้พัก 10 นาที,Morning
10:40:00 AM,ทำงาน,น่าเบื่อ,ได้เงิน,Morning
10:45:00 AM,พักเบรค หาอะไรรองท้อง,หิว ไม่มีพลังในการทำงาน,อิ่ม มีแรงในการทำงาน,Morning
11:00:00 AM,ทำงาน,เหนื่อย เบื่อ,งานเสร็จ,Morning
11:00:00 AM,ทำงานต่อ,งานยังไม่เสร็จ,งานเสร็จทันตามแผน,Morning
11:00:00 AM,meeting team (update sprint plan),เหนื่อย,"ได้ update งาน , ได้คุยกับทีม",Morning
11:00:00 AM,เรียนหนังสือ (online),,,Morning
11:00:00 AM,เข้าไลน์การผลิต เพื่อดูเครื่องจักร,เสียงดัง เมื่อยเพราะยืนทำงาน,ทดสอบเครื่องจักรและแก้ไขปัญหาได้ทันที,Morning
11:00:00 AM,ทำงาน,แก้งานจุดเดิมเพิ่ม,สนุกที่ได้ทำงานต่างๆ,Morning
11:00:00 AM,กลับถึงโรงแรม,,,Morning
11:00:00 AM,Solve and sourcing,A lot of products and services,A fit solution for budget and tech.,Morning
11:00:00 AM,เดินไปดูสภาพการทำงานของเครื่องจักร,ร้อน ฝุ่นเยอะ,ทราบสภาพการณ์ของเครื่องจักร,Morning
11:00:00 AM,ไปห้างสรรพสินค้า,เสียเวลาในการเดินทางและการหาที่จอดรถ,มีสินค้าให้เลือกเยอะ,Morning
11:15:00 AM,ทำงานที่ได้รับมอบหมาย,งานยังไม่เสร็จ,งานมี progress,Noon
11:15:00 AM,อาบน้ำ แต่งตัว แต่งหน้า,,,Noon
11:30:00 AM,กินข้าวเที่ยง,กินอะไรดี,เพื่อนช่วยคิดร้าน,Noon
11:30:00 AM,งีบหลับบนโซฟา,ง่วงนอน นอนไม่เต็มอิ่ม,พักผ่อน,Noon
11:30:00 AM,กินข้าวเที่ยง,คิดไม่ออกกินไรดี ของก็แพง แถมไม่อร่อย ที่สำคัญไม่อิ่ม,เติมพลังงานที่ต้องใช้ในชีวิตประจำวัน,Noon
11:30:00 AM,Having lunch,"- Must go to the cafeteria before 11.30 am unless the food is sold out.
- Tables and chairs are insufficient amounts.
- Sometimes still being full of breakfast or is not yet hungry, but we need to go for a lunch.","- relax from working 
- have time to walk and little exercise to the canteen",Noon
11:30:00 AM,Lunch time,Feeling bored with the same menu,,Noon
11:30:00 AM,พักเที่ยงกินข้าว,หิว,อิ่มท้อง,Noon
11:30:00 AM,ทานอาหารเที่ยงในห้างสรรพสินค้า,รอคิวนาน รออาหารนาน,เปลี่ยนบรรยากาศ,Noon
11:40:00 AM,สั่งข้าวกลางวัน,ค่าส่งแพง,ไม่ต้องเดินตากแดดลงไปกิน,Noon
11:45:00 AM,ดูทีวี,เสียเวลา ไม่ได้เรียนให้จบ,ได้ผ่อนคลาย,Noon
11:45:00 AM,ออกไปทานข้าวเที่ยง,"ขี้เกียจขับรถ, รถติด",รู้สึกผ่อนคลายเมื่อออกไปข้างนอก,Noon
12:00:00 PM,ออกไปกินข้าว,ขับรถออกไปกิน เปลืองน้ำมัน + แดดร้อน,กับข้าวอร่อยกว่าโรงอาหาร,Noon
12:00:00 PM,พักเบรคเที่ยง กินข้าว อ่านนิยาย 1 ตอน เช็คข่าวใน Social เล่นเกมส์ 1 รอบ,หิว ไม่มีพลังในการทำงาน เบื่อ,อิ่ม มีพลังในการทำงาน ได้พักคลายเครียดทำในสิ่งที่รู้สึกชอบ,Noon
12:00:00 PM,Have lunch nearby,Need to hurry but nearby restaurants are quite busy,Wider selection of foods,Noon
12:00:00 PM,ทานข้าวเที่ยง,หาเมนูยากเหลือเกิน,อิ่มท้อง,Noon
12:00:00 PM,เปิดตู้เย็น (หาอาหารทาน) พักเที่ยง,ไม่รู้นะกินอะไร,ได้เดินลงมาพัก,Noon
12:00:00 PM,Have lunch,"bored the same menu, and lazied to order food",gain energy,Noon
12:00:00 PM,กินข้าวกลางวันที่ทำงาน,คนเยอะ,ไม่ต้องเดินทางออกข้างนอก,Noon
12:00:00 PM,กินข้าวเที่ยง,คิดไม่ออก ไม่รู้จะกินอะไรดี,อิ่ม,Noon
12:00:00 PM,เลิกเรียน,เหนื่อยแล้ว หิวด้วย,ได้พัก,Noon
12:00:00 PM,Have lunch nearby,Have to drive and far sometimes depends on how far of selected restaurant,Wider selection of foods,Noon
12:00:00 PM,แต่งตัว,,,Noon
12:00:00 PM,กินข้าวกลางวันที่โรงอาหาร,น่าเบื่อ เมนูซ้ำซาก,ราคาไม่แพง ไม่ต้องออกไปข้างนอก,Noon
12:00:00 PM,รับประทานอาหารกลางวัน,อาหารไม่ถูกปาก,ที่ทำงานเลี้ยงข้าว อิ่มจัง ตังอยู่ครบ,Noon
12:00:00 PM,รับประทานอาหารกลางวัน,อาหารไม่ถูกปาก,ที่ทำงานเลี้ยงข้าว อิ่มจัง ตังอยู่ครบ,Noon
12:00:00 PM,ออกไปกินข้าว,มีแต่ร้านเดิมๆ,อิ่ม ได้คุยกับพี่ที่ทำงาน,Noon
12:00:00 PM,Check out ,,,Noon
12:00:00 PM,พักเที่ยง,คนแน่น,หายหิว,Noon
12:00:00 PM,กินข้าวกลางวันที่ออฟฟิศ,อาหารไม่อร่อย,ไม่ต้องเดินทาง,Noon
12:00:00 PM,ทานข้าวเที่ยง,หิว,อิ่ม,Noon
12:00:00 PM,กินข้าวเที่ยง,อยากกินบุฟเฟ่ แต่ไปกินไม่ได้เวลาน้อยไป,ท้องอิ่ม,Noon
12:00:00 PM,กินข้าวกลางวัน,มีแต่อาหารมันๆ,อิ่ม คลายเครียด,Noon
12:00:00 PM,Play ROV with friend,,Relax with the game,Noon
12:00:00 PM,กินอาหารกลางวัน,หิว,เม้ามอยด์กับทีม,Noon
12:00:00 PM,Lunch,Hot outside but wanna be outside,,Noon
12:00:00 PM,สั่งอาหารเที่ยงผ่าน Food panda,ไม่อยากออกไปซื้อเอง แถวที่ทำงานไม่มีร้านอร่อย อากาศร้อน กลัว COVID,ได้กินอาหารที่อยากกินทันพักเที่ยง,Noon
12:00:00 PM,Lunch time,,I'm full because of Pizza I bought from Italian Restaurant,Noon
12:00:00 PM,ออกไป ทานข้าวที่ cosmo bazaar,เสียเวลาเดินทางช่วงพักเที่ยง  แม้จะใช้เวลาแค่ 20 นาที  ,มีอาหารอร่อยๆให้เลือกเยอะ,Noon
12:00:00 PM,ทานข้าวเที่ยง,ร้านอาหารเยอะเลือกไม่ถูก,คนน้อยไม่ต้องรอนาน,Noon
12:00:00 PM,Lunch,Do not hungry but have to eat,filling,Noon
12:00:00 PM,ไปร้านกาแฟ กินกาแฟ,ง่วง,พักผ่อน,Noon
12:00:00 PM,กินอาหารกลางวัน,ไม่รู้จะกินอะไรดี,พักจากการทำงาน อิ่ม,Noon
12:00:00 PM,สั่งข้าว,ต้องรอ grab 30 นาที,มีเวลาดู port หุ้นต่างๆ,Noon
12:00:00 PM,กินข้าว,อาหารไม่อร่อย,รู้สึกอิ่มอยู่ท้อง,Noon
12:00:00 PM,Do homework,,Skill development,Noon
12:00:00 PM,กินข้าวเที่ยง,ง่วง,"อร่อย,สนุกกับการเลือกอาหาร",Noon
12:00:00 PM,พักเที่ยง,หิว,หายหิว,Noon
12:05:00 PM,เล่นหุ้น,Port 3 ประเทศคนละ timezone,มีเงินค่ากาแฟประจำวัน,Noon
12:10:00 PM,ออกไปหาอะไรกิน,ขี้เกียจออกไปข้างนอก,ได้รับอากาศดี ๆ,Noon
12:10:00 PM,เล่น ROV กับพี่ๆในทีม,หัวร้อน,The star ค้นฟ้าคว้าดาว !!,Noon
12:10:00 PM,ลงไปซื้อกาแฟ,บางวันถ้าไม่กิน ตอนบ่ายจะง่วง,,Noon
12:15:00 PM,กินต้มยำทะเลไข่เจียวกับข้าวเปล่า,กินอาหารอย่างเดียวไม่อิ่ม,อิ่มมากขึ้นเพราะเพิ่มไข่เจียว,Noon
12:15:00 PM,พูดคุยตามอัธยาศัยกับทีมงาน,เหนื่อย,สนุกสนาน,Noon
12:25:00 PM,คุยแลกเปลี่ยนกับคนในทีม,ตอนทำงานบางทีบรรยากาศตรึงเครียด,ได้ relax และพูดคุยนอกจากเรื่องงานกับคนในทีม,Noon
12:30:00 PM,ไปร้านกาแฟ,,เติมความหวานให้ชีวิต,Noon
12:30:00 PM,ออกไปสั่งอาหารตามสั่ง,"ร้อน,ฝุ่นเยอะ,ลำบาก","ได้กินอาหารอร่อย, อิ่มท้อง",Noon
12:30:00 PM,นั่งคุยกับเพื่อนร่วมงาน,อยากนอน,พักผ่อน สนุก คลายเครียด,Noon
12:30:00 PM,แอบงีบ,ที่นอนไม่ค่อยสบายเพราะนอนที่โต๊ะทำงาน,พักผ่อน,Noon
12:30:00 PM,แอบงีบ,ที่นอนไม่ค่อยสบายเพราะนอนที่โต๊ะทำงาน,พักผ่อน,Noon
12:30:00 PM,กลับมาทำงาน(ต่อ),ท้องอิ่มละง่วง,,Noon
12:30:00 PM,Continue working,Hard working to deal with plant member,,Noon
12:30:00 PM,หมดเวลาพัก กลับไปทำงานต่อ,หมดเวลาพักผ่อน,จัดการงานต่อ,Noon
12:30:00 PM,กินข้าว,ต้องลงไปเอาข้าวด้านล่าง,อิ่ม,Noon
12:30:00 PM,กินข้าวเที่ยง,ถ้ามีประชุมตอนบ่าย จะกินข้าวไม่ทัน ไม่มีเวลาเดินช๊อปปิ้งตลาดนัด,ถ้ามีประชุมตอนบ่าย จะมีเวลาเดินช๊อปปิ้งตลาดนัด,Noon
12:30:00 PM,นอนกลางวัน,ง่วงนอน ไม่สดชื่น,ตื่นมาสดชื่น พร้อมทำงานต่อช่วงบ่าย,Noon
12:30:00 PM,กลับเข้ามาโรงงาน,-,-,Noon
12:30:00 PM,Have lunch at baan somtum,waiting queue so long,update status by posting ig stories,Noon
12:30:00 PM,Shopping ซื้อของแต่งบ้าน,ใช้เวลาเลือกซื้อสินค้านาน,ซื้อสินค้าที่อยากได้ทันที,Noon
12:40:00 PM,อาบน้ำ,ร้อน,ตัวเย็นขึ้น,Noon
12:40:00 PM,นั่งสมาธิ,-,คลายเครียจจากการทำงาน,Noon
12:40:00 PM,นอนกลางวัน,,ได้พักผ่อน,Noon
12:45:00 PM,ซื้อกาแฟ,ได้ช้า,หายง่วง,Noon
12:45:00 PM,งีบ,งีบไม่ค่อยหลับ,ได้พักผ่อนเต็มที่,Noon
12:50:00 PM,ซื้อกาแฟ,ง่วงตอนบ่าย,ลดอาการง่วงในขณะทำงาน,Noon
12:50:00 PM,กินข้าว,พลังงานหมด,อิ่ม,Noon
1:00:00 PM,ทำงาน,เหนื่อย เบื่อ,งานเสร็จ,Noon
1:00:00 PM,ไปร้านชาไข่มุก,อ้วน,อร่อย มีความสุข,Noon
1:00:00 PM,กลับมาทำงาน,ง่วงเพราะกินเยอะ,,Noon
1:00:00 PM,ทำงานต่อ,งานยังไม่เสร็จ,งานเสร็จทันตามแผน,Noon
1:00:00 PM,สั่งข้าวผ่าน Line man,ไม่รู้จะกินอะไรดี,ไม่ต้องออกไปหาซื้อ,Noon
1:00:00 PM,กินอาหาเที่ยง,มีร้านให้เลือกน้อย,พักจากการทำงาน และอิ่มท้อง,Noon
1:00:00 PM,Work on a Python script that fetches data from DB to do model scoring,The server doesn't have a query tool. Using Python to do SQL query can be inconvenient,"With the server's capabilities and intranet to connect to the internal DB, the work is much faster than using my own laptop via VPN",Noon
1:00:00 PM,ชงกาแฟ,,อร่อย+แก้ง่วง,Noon
1:00:00 PM,Continue working,do the same things,,Noon
1:00:00 PM,เริ่มทำงาน,,,Noon
1:00:00 PM,เริ่มทำงานรอบบ่าย,งานยังไม่เสร็จ,งานมี progress มากขึ้น,Noon
1:00:00 PM,เดินทางออกจากบ้านไปนวด คอ บ่า ไหล่,ต้องเดินทางไป เสียเวลารถติด,ผ่อนคลาย สบายตัว,Noon
1:00:00 PM,เริ่มเรียน,ไม่มี,ได้ความรู้ใหม่ ๆ,Noon
1:00:00 PM,"Work on SQL queries, Power BI",New issues come everyday,Learn something new to gain more knowledge,Noon
1:00:00 PM,กินข้าวกลางวัน ที่ร้านก๋วยเตี๋ยวแถวบ้าน,,คนไม่พลุกพล่าน,Noon
1:00:00 PM,เริ่มทำงาน(ต่อ),จิตใจห่อเหี่ยว,ได้เคลียร์งานตามหน้าที่และความรับผิดชอบ,Noon
1:00:00 PM,เข้าห้องน้ำ แปรงฟัน,ขี้เกียจแปรงฟัน,ลมหายใจสดชื่น มั่นใจที่คุยกับคนอื่น,Noon
1:00:00 PM,ทำงาน,น่าเบื่อ,ได้เงิน,Noon
1:00:00 PM,เริ่มงานช่วงบ่าย เปิด PO,PR ผิดเยอะมาก ,,Noon
1:00:00 PM,เริ่มงานช่วงบ่าย เปิด PO,PR ผิดเยอะมาก ,,Noon
1:00:00 PM,Start working again,- Being full and sometimes feel sleepy,- less work efficiency,Noon
1:00:00 PM,ทานมื้อเที่ยง,ทานเมนูเดิม,อิ่ม,Noon
1:00:00 PM,กลับมาทำงาน,ง่วงเพราะกินเยอะไป,ใกล้เลิกงานแล้ว,Noon
1:00:00 PM,กินข้าวเที่ยงที่ร้านสลักเพชร,"ปลาหมดทุกอย่างยกเว้นปลาเก๋า, แพงไปหน่อย","อร่อย, ทิวทัศน์ร้านอาหารสวยงาม",Noon
1:00:00 PM,ซื้อชาไข่มุก,อยากกินน้ำหวาน,อารมณ์ดี,Noon
